<?xml version="1.0" encoding="UTF-8"?>
<resenje xmlns="http://www.ftn.uns.rs/ResenjePatent"
    xmlns:xsi="http://www.w3.org/2001/XMLSchema-instance"
    xsi:schemaLocation="http://www.ftn.uns.rs/ResenjePatent file:/C:/Users/Kssbc/Documents/GitHub/XML-Projekat/xml/Patent/ResenjePatent.xsd"
    id=""
    xmlns:pred="http://www.ftn.uns.ac.rs/rdf/resenje/predicate/"
    >
    <datum_odluke_o_zahtevu about="http://www.ftn.uns.ac.rs/rdf/resenjePatent" property="pred:datumOdlukeOZahtevu" datatype="xs:string"></datum_odluke_o_zahtevu>
    <da_li_je_prosao>
        <sifra></sifra>
        <!--<obrazlozenje></obrazlozenje>-->
    </da_li_je_prosao>
    <sluzbenik about="http://www.ftn.uns.ac.rs/rdf/resenjePatent">
        <ime property="pred:ime" datatype="xs:string"></ime>
        <prezime property="pred:prezime" datatype="xs:string"></prezime>
    </sluzbenik>
    <referenca_na_zahtev></referenca_na_zahtev>
</resenje>